{
  "format": "raw.author",
  "version": 1,
  "project": {"name": "Boss Fight", "tempo": 148},
  "instruments": [
    {
      "name": "square_lead",
      "oscillator": "square",
      "duty": 0.25,
      "pitch": "C4",
      "root_note": "C4",
      "duration": 0.22,
      "amplitude": 0.6,
      "envelope": [0.004, 0.05, 0.7, 0.06],
      "brightness": 0.62,
      "drift": 0.12,
      "stretch": "preserve_attack"
    },
    {
      "name": "bass_pulse",
      "oscillator": "square",
      "duty": 0.5,
      "pitch": "C2",
      "root_note": "C2",
      "duration": 0.2,
      "amplitude": 0.6,
      "envelope": [0.002, 0.08, 0.55, 0.05],
      "brightness": 0.35,
      "drift": 0.1,
      "stretch": "preserve_attack"
    },
    {
      "name": "drum_kick",
      "oscillator": "sine",
      "pitch": {"from": 170, "to": 45, "curve": "exponential"},
      "root_note": "F2",
      "duration": 0.18,
      "envelope": [0.001, 0.07, 0.2, 0.08],
      "amplitude": 0.8,
      "drift": 0.05
    },
    {
      "name": "drum_snare",
      "oscillator": "white",
      "pitch": 1200,
      "duration": 0.15,
      "amplitude": 0.5,
      "envelope": [0.001, 0.05, 0.15, 0.09],
      "filters": [
        {"type": "highpass", "cutoff": 900, "resonance": 0.8},
        {"type": "bitcrush", "bits": 8}
      ]
    }
  ],
  "patterns": [
    {
      "name": "pattern_boss_a",
      "tempo": 148,
      "steps": 16,
      "step": "1/16",
      "tracks": [
        {
          "name": "lead",
          "instrument": "square_lead",
          "overrides": {"volume_db": -9},
          "notes": "C5 . D#5 . G5 - . F5 | D#5 . C5 . A#4 - . ."
        },
        {
          "name": "bass",
          "instrument": "bass_pulse",
          "overrides": {"volume_db": -10},
          "notes": "C2 . C2 . G#1 . G#1 . | A#1 . A#1 . G1 . G1 ."
        },
        {
          "name": "kick",
          "instrument": "drum_kick",
          "overrides": {"volume_db": -6},
          "notes": "x . . . x . . . | x . . x . . x ."
        },
        {
          "name": "snare",
          "instrument": "drum_snare",
          "overrides": {"volume_db": -10},
          "notes": ". . . . X . . . | . . . . X . . ."
        }
      ]
    }
  ]
}
