{
  "format": "raw.author",
  "version": 1,
  "project": {"name": "Low Beeps", "tempo": 92},
  "instruments": [
    {
      "name": "beep_low",
      "oscillator": "square",
      "duty": 0.5,
      "pitch": "E3",
      "root_note": "E3",
      "duration": 0.16,
      "amplitude": 0.7,
      "envelope": [0.001, 0.05, 0.35, 0.06],
      "brightness": 0.28,
      "drift": 0.12,
      "stretch": "preserve_attack",
      "filters": [{"type": "lowpass", "cutoff": 1400, "resonance": 0.7}],
      "tags": ["melody", "beep"]
    },
    {
      "name": "beep_sub",
      "oscillator": "triangle",
      "pitch": "E2",
      "root_note": "E2",
      "duration": 0.42,
      "amplitude": 0.8,
      "envelope": [0.002, 0.12, 0.5, 0.16],
      "brightness": 0.2,
      "drift": 0.08,
      "stretch": "preserve_attack",
      "filters": [{"type": "lowpass", "cutoff": 700, "resonance": 0.6}],
      "tags": ["bass", "beep"]
    }
  ],
  "patterns": [
    {
      "name": "pattern_low_beeps",
      "tempo": 92,
      "steps": 32,
      "step": "1/8",
      "tracks": [
        {
          "name": "arp",
          "instrument": "beep_low",
          "overrides": {"volume_db": -7},
          "notes": "E3 . G3 . B3 . G3 . | A2 . B2 . C3 . E3 . | C3 . E3 . G3 . B3 . | A2 . C3 . E3 . B2 ."
        },
        {
          "name": "bass",
          "instrument": "beep_sub",
          "overrides": {"volume_db": -6},
          "notes": "E2 - - . . . . . | A1 - - . . . . . | C2 - - . . . . . | A1 - - . . . . ."
        }
      ]
    }
  ]
}
